{
    "id":  "multi-tenant-saas",
    "name":  "Multi Tenant SaaS",
    "type":  "domain",
    "version":  "1.0.0",
    "status":  "available",
    "description":  "Evidence-gated Multi Tenant SaaS domain guardrails. Use when authoritative project source, schema, tests, contracts, or specifications verify this domain and the active task touches tenant ownership, organization/workspace membership, tenant-scoped data, or cross-tenant administration; never infer business invariants from names.",
    "purpose":  "Protect verified tenant ownership, isolation, membership, and cross-tenant administration semantics.",
    "upstream_technology":  null,
    "supported_versions":  [
                               "Not technology-versioned; project overlay schema/version is evidence-specific."
                           ],
    "detected_project_version":  null,
    "activation_mode":  "confirmation_required",
    "activation_conditions":  [
                                  "Project domain manifest has at least MEDIUM confidence from independent authoritative artifacts.",
                                  "At least one project invariant is verified with source citations in an overlay.",
                                  "Task intersects the binding scope and domain concepts."
                              ],
    "deactivation_conditions":  [
                                    "Authoritative evidence is removed, contradicted, or superseded.",
                                    "No verified overlay rules remain.",
                                    "Task does not intersect the bound domain scope."
                                ],
    "detection_rules":  [
                            "See ../../../DOMAIN-DETECTION-RULES.json#skill_id=multi-tenant-saas"
                        ],
    "confidence_requirement":  "HIGH or MEDIUM plus at least one evidence-cited verified project rule; LOW requires confirmation and remains provisional; NONE is inactive.",
    "task_triggers":  [
                          "tenant ownership, organization/workspace membership, tenant-scoped data, or cross-tenant administration",
                          "tenant authorization and data isolation"
                      ],
    "affected_layers":  [
                            "domain",
                            "database",
                            "api",
                            "auth",
                            "jobs",
                            "tests"
                        ],
    "standard_skill_dependencies":  [
                                        "domain-skill-framework",
                                        "requirement-analysis",
                                        "project-memory",
                                        "security-threat-modeling",
                                        "backend-production-engineering",
                                        "data-lifecycle"
                                    ],
    "compatible_skills":  [
                              "rbac-scoped-access",
                              "subscription-billing",
                              "analytics-events"
                          ],
    "incompatible_skills":  [

                            ],
    "prerequisite_skills":  [

                            ],
    "required_inputs":  [
                            "Active domain binding and project overlay.",
                            "Citations to source, schema/migration, tests, contract, or authoritative specification.",
                            "Affected actor, scope, state, transition, and failure/recovery context."
                        ],
    "expected_outputs":  [
                             "Implementation or review that preserves only verified invariants.",
                             "Tests for affected authorized, unauthorized, valid, invalid, retry, and concurrency paths as applicable.",
                             "Overlay/memory update when durable verified domain knowledge changes."
                         ],
    "rules":  [
                  "Treat candidate concepts and lifecycles as questions until repository evidence verifies them.",
                  "Preserve verified invariants across API, data, UI, jobs, events, and tests.",
                  "Make authorization, idempotency, concurrency, audit, failure, and recovery behavior explicit where the verified model requires them.",
                  "Verify tenant scope at every trusted data-access boundary."
              ],
    "blockers":  [
                     "No active binding or no evidence-cited overlay.",
                     "Evidence is inferential, ambiguous, or contradicted.",
                     "Requested behavior would weaken a verified invariant, authorization rule, auditability, or recovery guarantee.",
                     "Tenant key propagation or global-resource semantics are unclear."
                 ],
    "patterns":  [
                     "Explicit tenant context with deny-by-default access.",
                     "Isolation tests using two or more tenants."
                 ],
    "anti_patterns":  [
                          "Infer a domain model from nouns, UI labels, routes, comments, or technology.",
                          "Promote a candidate state or transition to an invariant without citations.",
                          "Put project-specific business rules in the reusable base.",
                          "Trust a client-supplied tenant identifier without authorization."
                      ],
    "validation":  [
                       "Can one tenant read or mutate another tenant data path?",
                       "How are background jobs and caches scoped?",
                       "Which actors may cross tenant boundaries, and where is that audited?"
                   ],
    "completion_criteria":  [
                                "Every applied domain rule maps to cited authoritative evidence.",
                                "Affected lifecycle, authorization, idempotency, concurrency, audit, and recovery cases are validated as applicable.",
                                "Project manifests, overlay, tests, and memory remain synchronized."
                            ],
    "official_source_policy":  "For domain facts, authoritative project source, schema, tests, contracts, and approved specifications outrank generic external material; label conflicts and unknowns, and never use model memory as proof.",
    "memory_read_policy":  "Read only relevant domain/module decisions and verify them against current repository evidence before use.",
    "memory_write_policy":  "Write durable verified invariants with evidence and scope; record unknowns separately; never store secrets, personal data, or speculation.",
    "project_overlay_policy":  "All verified project actors, states, transitions, formulas, paths, identifiers, and exceptions belong in Layer B with citations; the reusable base contains only guardrails.",
    "update_policy":  "Re-run detection and review overlay evidence after schema, contract, lifecycle, authorization, or major domain behavior changes.",
    "deprecation_policy":  "Mark superseded invariants with replacement evidence and migration impact; deactivate the binding when no verified rules remain.",
    "scope_policy":  "Apply only to domain concepts, packages, and paths covered by evidence-cited overlay rules; unverified concepts remain out of scope."
}
