{
    "id":  "ai-llm-integration",
    "name":  "AI LLM Integration",
    "type":  "technology",
    "version":  "1.0.0",
    "status":  "available",
    "description":  "Version-aware AI LLM Integration production guidance. Use only when project detection and an active binding prove this technology is in the task scope; trigger on editing model calls, prompts, tool use, structured output, embeddings, retrieval, streaming, guardrails, evaluation, or AI provider configuration.",
    "purpose":  "Keep model/provider APIs, prompts, tools, structured output, retrieval, safety, privacy, cost, and observability aligned with verified provider contracts.",
    "upstream_technology":  "Detected AI model provider and OWASP GenAI guidance",
    "supported_versions":  [
                               "Detected project versions supported by the selected upstream release line; no version is assumed by the base skill."
                           ],
    "detected_project_version":  null,
    "activation_mode":  "confirmation_required",
    "activation_conditions":  [
                                  "Project stack manifest marks detection true.",
                                  "Confidence is HIGH or MEDIUM; LOW requires confirmation.",
                                  "Task intersects an applicable package, path, and task type in the active binding."
                              ],
    "deactivation_conditions":  [
                                    "Technology evidence is removed or becomes contradictory.",
                                    "Binding scope no longer intersects the task.",
                                    "Detected release is unsupported or compatibility is unresolved."
                                ],
    "detection_rules":  [
                            "See ../../../STACK-DETECTION-RULES.json#skill_id=ai-llm-integration"
                        ],
    "confidence_requirement":  "HIGH or MEDIUM for normal routing; LOW requires explicit confirmation; NONE is inactive.",
    "task_triggers":  [
                          "editing model calls, prompts, tool use, structured output, embeddings, retrieval, streaming, guardrails, evaluation, or AI provider configuration",
                          "reviewing AI integration safety, reliability, privacy, or cost"
                      ],
    "affected_layers":  [
                            "ai-integration",
                            "backend",
                            "data",
                            "security",
                            "observability",
                            "tests"
                        ],
    "standard_skill_dependencies":  [
                                        "ai-agent-safety",
                                        "api-integration",
                                        "security-threat-modeling",
                                        "observability-incident",
                                        "testing-quality",
                                        "data-lifecycle"
                                    ],
    "compatible_skills":  [
                              "nextjs",
                              "vite-react",
                              "supabase-platform",
                              "nodejs-runtime",
                              "ai-agent-domain"
                          ],
    "incompatible_skills":  [

                            ],
    "prerequisite_skills":  [

                            ],
    "required_inputs":  [
                            "Active custom-skill binding.",
                            "Repository evidence and applicable scope.",
                            "Detected installed/platform version for version-sensitive work.",
                            "Task acceptance criteria and relevant Standard Skill context."
                        ],
    "expected_outputs":  [
                             "Change or review aligned to the detected release and repository conventions.",
                             "Validation evidence scoped to affected paths.",
                             "Manifest, overlay, and memory updates only when durable facts changed."
                         ],
    "rules":  [
                  "Detect provider, model, SDK, and API version before selecting features.",
                  "Treat prompts, retrieved content, model output, and tool arguments as untrusted data.",
                  "Bound agency, cost, retries, timeouts, data retention, and failure modes."
              ],
    "blockers":  [
                     "No active binding or no task/scope intersection.",
                     "Only comment, filename, or model-memory evidence exists.",
                     "A requested rule conflicts with the Constitution or required Standard Skills.",
                     "Provider/model contract, data classification, or action approval boundary is unknown."
                 ],
    "patterns":  [
                     "Schema-validated outputs with deterministic fallback.",
                     "Evaluation fixtures and traceable model/provider metadata without sensitive content."
                 ],
    "anti_patterns":  [
                          "Assume the newest upstream release is installed.",
                          "Apply the skill across unrelated monorepo packages.",
                          "Copy upstream documentation or upgrade dependencies without task authority.",
                          "Execute model output directly.",
                          "Send secrets or restricted data without an approved provider/data policy."
                      ],
    "validation":  [
                       "Run contract mocks, adversarial/safety tests, structured-output validation, timeout/retry tests, evaluation fixtures, and cost/telemetry checks."
                   ],
    "completion_criteria":  [
                                "Relevant tests/lints/checks pass or an evidence-backed exception is recorded.",
                                "Detection and activation manifests remain synchronized.",
                                "No project fact or secret leaked into Layer A."
                            ],
    "official_source_policy":  "Use only official upstream documentation for version-sensitive claims; record checked date and distinguish verified, deprecated, migration, and unverified guidance in UPSTREAM.md.",
    "memory_read_policy":  "Read project memory only for the affected module and decisions; never treat stale memory as stronger than repository evidence.",
    "memory_write_policy":  "Write only durable verified decisions, constraints, failures, or patterns; never write secrets or speculative versions.",
    "project_overlay_policy":  "Project-specific paths, versions, conventions, and narrowing rules belong in Layer B; overlays cannot weaken base, security, compatibility, or production rules.",
    "update_policy":  "Re-verify official sources after detected major upgrades, deprecations, platform changes, or conflicting repository evidence; do not force dependency upgrades.",
    "deprecation_policy":  "Mark deprecated before disabling, name the replacement or migration path, keep compatibility warnings, and deactivate bindings when evidence disappears.",
    "scope_policy":  "Apply only to packages and paths declared in an active binding; repository-wide scope requires evidence that every included package uses the technology."
}
