{
    "id":  "tailwind-shadcn",
    "name":  "Tailwind shadcn",
    "type":  "technology",
    "version":  "1.0.0",
    "status":  "available",
    "description":  "Version-aware Tailwind shadcn production guidance. Use only when project detection and an active binding prove this technology is in the task scope; trigger on editing Tailwind configuration or CSS, shadcn components, design tokens, responsive layout, themes, or component registry configuration.",
    "purpose":  "Keep styling, tokens, component ownership, accessibility, responsive behavior, and tooling aligned with detected Tailwind and shadcn configuration.",
    "upstream_technology":  "Tailwind CSS and shadcn/ui",
    "supported_versions":  [
                               "Detected project versions supported by the selected upstream release line; no version is assumed by the base skill."
                           ],
    "detected_project_version":  null,
    "activation_mode":  "auto",
    "activation_conditions":  [
                                  "Project stack manifest marks detection true.",
                                  "Confidence is HIGH or MEDIUM; LOW requires confirmation.",
                                  "Task intersects an applicable package, path, and task type in the active binding."
                              ],
    "deactivation_conditions":  [
                                    "Technology evidence is removed or becomes contradictory.",
                                    "Binding scope no longer intersects the task.",
                                    "Detected release is unsupported or compatibility is unresolved."
                                ],
    "detection_rules":  [
                            "See ../../../STACK-DETECTION-RULES.json#skill_id=tailwind-shadcn"
                        ],
    "confidence_requirement":  "HIGH or MEDIUM for normal routing; LOW requires explicit confirmation; NONE is inactive.",
    "task_triggers":  [
                          "editing Tailwind configuration or CSS, shadcn components, design tokens, responsive layout, themes, or component registry configuration",
                          "reviewing visual consistency and accessibility"
                      ],
    "affected_layers":  [
                            "frontend",
                            "design-system",
                            "styles",
                            "tests"
                        ],
    "standard_skill_dependencies":  [
                                        "ui-ux-production",
                                        "testing-quality",
                                        "dependency-evolution"
                                    ],
    "compatible_skills":  [
                              "react-typescript",
                              "nextjs",
                              "vite-react",
                              "react-hook-form-zod"
                          ],
    "incompatible_skills":  [

                            ],
    "prerequisite_skills":  [
                                "react-typescript"
                            ],
    "required_inputs":  [
                            "Active custom-skill binding.",
                            "Repository evidence and applicable scope.",
                            "Detected installed/platform version for version-sensitive work.",
                            "Task acceptance criteria and relevant Standard Skill context."
                        ],
    "expected_outputs":  [
                             "Change or review aligned to the detected release and repository conventions.",
                             "Validation evidence scoped to affected paths.",
                             "Manifest, overlay, and memory updates only when durable facts changed."
                         ],
    "rules":  [
                  "Treat installed shadcn components as owned source code and preserve local conventions.",
                  "Use semantic tokens instead of repeated arbitrary values.",
                  "Verify keyboard, focus, contrast, responsive, and state behavior."
              ],
    "blockers":  [
                     "No active binding or no task/scope intersection.",
                     "Only comment, filename, or model-memory evidence exists.",
                     "A requested rule conflicts with the Constitution or required Standard Skills.",
                     "Tailwind major, components.json style, or token ownership is unknown for a configuration rewrite."
                 ],
    "patterns":  [
                     "Composable primitives with variant-based APIs.",
                     "Mobile-first layouts using repository tokens."
                 ],
    "anti_patterns":  [
                          "Assume the newest upstream release is installed.",
                          "Apply the skill across unrelated monorepo packages.",
                          "Copy upstream documentation or upgrade dependencies without task authority.",
                          "Overwrite customized shadcn components from examples.",
                          "Mix Tailwind major-specific configuration models."
                      ],
    "validation":  [
                       "Run style/build checks, component tests, accessibility checks, and targeted visual/browser verification."
                   ],
    "completion_criteria":  [
                                "Relevant tests/lints/checks pass or an evidence-backed exception is recorded.",
                                "Detection and activation manifests remain synchronized.",
                                "No project fact or secret leaked into Layer A."
                            ],
    "official_source_policy":  "Use only official upstream documentation for version-sensitive claims; record checked date and distinguish verified, deprecated, migration, and unverified guidance in UPSTREAM.md.",
    "memory_read_policy":  "Read project memory only for the affected module and decisions; never treat stale memory as stronger than repository evidence.",
    "memory_write_policy":  "Write only durable verified decisions, constraints, failures, or patterns; never write secrets or speculative versions.",
    "project_overlay_policy":  "Project-specific paths, versions, conventions, and narrowing rules belong in Layer B; overlays cannot weaken base, security, compatibility, or production rules.",
    "update_policy":  "Re-verify official sources after detected major upgrades, deprecations, platform changes, or conflicting repository evidence; do not force dependency upgrades.",
    "deprecation_policy":  "Mark deprecated before disabling, name the replacement or migration path, keep compatibility warnings, and deactivate bindings when evidence disappears.",
    "scope_policy":  "Apply only to packages and paths declared in an active binding; repository-wide scope requires evidence that every included package uses the technology."
}
