{
    "id":  "gift-lifecycle",
    "name":  "Gift Lifecycle",
    "type":  "domain",
    "version":  "1.0.0",
    "status":  "available",
    "description":  "Evidence-gated Gift Lifecycle domain guardrails. Use when authoritative project source, schema, tests, contracts, or specifications verify this domain and the active task touches gifts, senders, recipients, delivery, claim, redemption, expiry, cancellation, or transfer; never infer business invariants from names.",
    "purpose":  "Protect verified creation, purchase, delivery, claim, redemption, expiry, cancellation, and transfer semantics.",
    "upstream_technology":  null,
    "supported_versions":  [
                               "Not technology-versioned; project overlay schema/version is evidence-specific."
                           ],
    "detected_project_version":  null,
    "activation_mode":  "confirmation_required",
    "activation_conditions":  [
                                  "Project domain manifest has at least MEDIUM confidence from independent authoritative artifacts.",
                                  "At least one project invariant is verified with source citations in an overlay.",
                                  "Task intersects the binding scope and domain concepts."
                              ],
    "deactivation_conditions":  [
                                    "Authoritative evidence is removed, contradicted, or superseded.",
                                    "No verified overlay rules remain.",
                                    "Task does not intersect the bound domain scope."
                                ],
    "detection_rules":  [
                            "See ../../../DOMAIN-DETECTION-RULES.json#skill_id=gift-lifecycle"
                        ],
    "confidence_requirement":  "HIGH or MEDIUM plus at least one evidence-cited verified project rule; LOW requires confirmation and remains provisional; NONE is inactive.",
    "task_triggers":  [
                          "gifts, senders, recipients, delivery, claim, redemption, expiry, cancellation, or transfer",
                          "gift state transitions and entitlement"
                      ],
    "affected_layers":  [
                            "domain",
                            "database",
                            "api",
                            "messaging",
                            "jobs",
                            "tests"
                        ],
    "standard_skill_dependencies":  [
                                        "domain-skill-framework",
                                        "requirement-analysis",
                                        "project-memory",
                                        "backend-production-engineering",
                                        "security-threat-modeling",
                                        "data-lifecycle"
                                    ],
    "compatible_skills":  [
                              "commerce-order-inventory",
                              "payment-reconciliation",
                              "notification-messaging"
                          ],
    "incompatible_skills":  [

                            ],
    "prerequisite_skills":  [

                            ],
    "required_inputs":  [
                            "Active domain binding and project overlay.",
                            "Citations to source, schema/migration, tests, contract, or authoritative specification.",
                            "Affected actor, scope, state, transition, and failure/recovery context."
                        ],
    "expected_outputs":  [
                             "Implementation or review that preserves only verified invariants.",
                             "Tests for affected authorized, unauthorized, valid, invalid, retry, and concurrency paths as applicable.",
                             "Overlay/memory update when durable verified domain knowledge changes."
                         ],
    "rules":  [
                  "Treat candidate concepts and lifecycles as questions until repository evidence verifies them.",
                  "Preserve verified invariants across API, data, UI, jobs, events, and tests.",
                  "Make authorization, idempotency, concurrency, audit, failure, and recovery behavior explicit where the verified model requires them.",
                  "Verify one-time and ownership transitions atomically where evidence requires them."
              ],
    "blockers":  [
                     "No active binding or no evidence-cited overlay.",
                     "Evidence is inferential, ambiguous, or contradicted.",
                     "Requested behavior would weaken a verified invariant, authorization rule, auditability, or recovery guarantee.",
                     "Gift value source, recipient identity, or redeemability rules are unclear."
                 ],
    "patterns":  [
                     "Opaque claim token with expiry and replay protection.",
                     "Auditable lifecycle transitions."
                 ],
    "anti_patterns":  [
                          "Infer a domain model from nouns, UI labels, routes, comments, or technology.",
                          "Promote a candidate state or transition to an invariant without citations.",
                          "Put project-specific business rules in the reusable base.",
                          "Authorize redemption from a guessable identifier."
                      ],
    "validation":  [
                       "Can a gift be claimed or redeemed twice?",
                       "What happens on delivery failure, expiry, refund, or transfer?",
                       "Which identities may inspect gift details before claim?"
                   ],
    "completion_criteria":  [
                                "Every applied domain rule maps to cited authoritative evidence.",
                                "Affected lifecycle, authorization, idempotency, concurrency, audit, and recovery cases are validated as applicable.",
                                "Project manifests, overlay, tests, and memory remain synchronized."
                            ],
    "official_source_policy":  "For domain facts, authoritative project source, schema, tests, contracts, and approved specifications outrank generic external material; label conflicts and unknowns, and never use model memory as proof.",
    "memory_read_policy":  "Read only relevant domain/module decisions and verify them against current repository evidence before use.",
    "memory_write_policy":  "Write durable verified invariants with evidence and scope; record unknowns separately; never store secrets, personal data, or speculation.",
    "project_overlay_policy":  "All verified project actors, states, transitions, formulas, paths, identifiers, and exceptions belong in Layer B with citations; the reusable base contains only guardrails.",
    "update_policy":  "Re-run detection and review overlay evidence after schema, contract, lifecycle, authorization, or major domain behavior changes.",
    "deprecation_policy":  "Mark superseded invariants with replacement evidence and migration impact; deactivate the binding when no verified rules remain.",
    "scope_policy":  "Apply only to domain concepts, packages, and paths covered by evidence-cited overlay rules; unverified concepts remain out of scope."
}
